{"$schema":"https://json-schema.org/draft/2020-12/schema","$id":"https://code-review-harness/schemas/enterprise-synthesis-evidence-gate.schema.json","title":"ENT-SYNTH Evidence Gate","type":"object","additionalProperties":false,"required":["gate_id","gate_version","created_at","scope_id","expected_designations","admitted_inputs","excluded_lineage","gate_state","scheduling_authorized","report_effect","deployment_effect","gate_hash"],"properties":{"gate_id":{"type":"string","format":"uuid"},"gate_version":{"const":"1.0.0"},"created_at":{"type":"string","format":"date-time"},"scope_id":{"const":"CODE-HARNESS-PROJECT-001"},"expected_designations":{"const":["ENT-SYSRISK","ENT-ARCH","ENT-GOV","ENT-STRAT"]},"admitted_inputs":{"type":"array","minItems":4,"maxItems":4,"items":{"type":"object","additionalProperties":false,"required":["designation","artifact_id","artifact_hash","eligibility_id","eligibility_hash"],"properties":{"designation":{"type":"string"},"artifact_id":{"type":"string","format":"uuid"},"artifact_hash":{"$ref":"#/$defs/hash"},"eligibility_id":{"type":["string","null"],"format":"uuid"},"eligibility_hash":{"anyOf":[{"$ref":"#/$defs/hash"},{"type":"null"}]}}}},"excluded_lineage":{"type":"array","items":{"type":"string"}},"gate_state":{"const":"admitted_for_candidate_evaluation"},"scheduling_authorized":{"const":false},"report_effect":{"const":"none"},"deployment_effect":{"const":"none"},"gate_hash":{"$ref":"#/$defs/hash"}},"$defs":{"hash":{"type":"string","pattern":"^sha256:[0-9a-f]{64}$"}}}
